SYMBOL,NAME,LAST PRICE,NET CHANGE,% CHANGE,DELTA,1 yr % CHANGE
EBUF,SHL Telemedicine Ltd Innovator Emerging Markets 10 Buffer ETF ,$27.3099,0.0311,0.11393777751725552%,up,
ECH,iShares Inc. iShares MSCI Chile ETF,$31.8200,-0.0900,-0.28346456692913385%,down,
ECLN,First Trust EIP Carbon Impact ETF,$31.1816,-0.1036,-0.3323719357457034%,down,
ECML,EA Series Trust Euclidean Fundamental Value ETF,$30.6753,0.1053,0.3450727995464571%,up,
ECNS,iShares MSCI China Small-Cap ETF,$31.2401,0.6127,1.9925203252032522%,up,
ECON,Columbia Research Enhanced Emerging Economies ETF,$23.4985,0.1895,0.8110629847117837%,up,
ECOW,Pacer Emerging Markets Cash Cows 100 ETF,$21.8000,0.0591,0.2729792147806005%,up,
EDC,Direxion Emerging Markets Bull 3X Shares,$37.2300,0.8800,2.4063439978124146%,up,
EDEN,iShares Inc iShares MSCI Denmark ETF,$121.3658,0.6135,0.5156679854654754%,up,
EDGF,The Advisors Inner Circle Fund II 3EDGE Dynamic Fixed Income E,$24.8200,0.0150,0.060447310094700786%,up,
EDGH,The Advisors Inner Circle Fund II 3EDGE Dynamic Hard Assets ET,$26.4600,0.0874,0.32946569259418423%,up,
EDGI,The Advisors Inner Circle Fund II 3EDGE Dynamic International ,$25.7918,0.0725,0.281433174178021%,up,
EDGU,The Advisors Inner Circle Fund II 3EDGE Dynamic US Equity ETF,$25.4900,0.0043,0.01694915254237288%,up,
EDIV,SPDR S&P Emerging Markets Dividend ETF,$38.4300,0.1800,0.4704652378463147%,up,
EDOG,ALPS Emerging Sector Dividend Dogs ETF,$22.3287,0.0710,0.31966430745403135%,up,
EDOW,First Trust Dow 30 Equal Weight ETF,$37.5900,0.0108,0.028877005347593587%,up,
EDV,Vanguard Extended Duration Treasury ETF,$64.9100,0.0300,0.04657661853749418%,up,
EDZ,Direxion Emerging Markets Bear 3X Shares,$5.8200,-0.1400,-2.3529411764705883%,down,
EELV,Invesco S&P Emerging Markets Low Volatility ETF,$26.0100,0.0100,0.03863987635239567%,up,
EEM,iShares MSCI Emerging Index Fund,$47.5900,0.4000,0.8453085376162299%,up,
EEMA,iShares MSCI Emerging Markets Asia ETF,$81.1700,0.9000,1.1167638664846755%,up,
EEMO,Invesco S&P Emerging Markets Momentum ETF,$16.5219,0.1450,0.881191127316925%,up,
EEMS,iShares MSCI Emerging Markets Small Cap ETF,$63.6301,0.3899,0.6169977418420682%,up,
EEMV,iShares MSCI Emerging Markets Min Vol Factor ETF,$62.2400,0.2350,0.3784219001610306%,up,
EEMX,SPDR MSCI Emerging Markets Fuel Reserves Free ETF,$36.7211,0.3073,0.8418024928092042%,up,
EES,WisdomTree U.S. SmallCap Fund,$50.9900,0.4400,0.8705975464978235%,up,
EET,ProShares Ultra MSCI Emerging Markets,$61.8542,0.9817,1.6056171248380808%,up,
EETH,ProShares Ether ETF,$51.1500,1.7600,3.70214556163231%,up,
EEV,ProShares UltraShort MSCI Emerging Markets,$13.1500,-0.2407,-1.8073827115996877%,down,
EFA,iShares MSCI EAFE ETF,$89.8500,-0.0100,-0.011144544745347151%,down,
EFAA,Invesco Actively Managed Exchange-Traded Fund Trus Invesco MSC,$51.1600,-0.0100,-0.019554165037152915%,down,
EFAD,ProShares Trust ProShares MSCI EAFE Dividend Growers ETF,$43.0066,0.1250,0.29171528588098017%,up,
EFAS,Global X MSCI SuperDividend EAFE ETF,$17.7000,0.0800,0.4517221908526256%,up,
EFAV,iShares MSCI EAFE Min Vol Factor ETF,$84.7500,-0.1600,-0.18892431219742592%,down,
EFAX,SPDR MSCI EAFE Fossil Fuel Reserves Free ETF,$46.6715,-0.0170,-0.03644705529232683%,down,
EFFE,Harbor ETF Trust Harbor Osmosis Emerging Markets Resource Effi,$22.1703,0.1744,0.7891259886698884%,up,
EFFI,Harbor ETF Trust Harbor Osmosis International Resource Efficie,$22.4277,0.0073,0.03261199764121442%,up,
EFG,iShares MSCI EAFE Growth ETF,$111.4800,0.0000,0%,unch,
EFIV,SPDR S&P 500 ESG ETF,$57.1500,-0.0400,-0.07041013906002463%,down,
EFNL,iShares Inc iShares MSCI Finland ETF,$41.3106,0.1675,0.4068743547701464%,up,
EFO,ProShares Ultra MSCI EAFE,$55.1850,-0.0307,-0.055691609977324266%,down,
EFRA,iShares Environmental Infrastructure and Industrials ETF,$33.3054,0.0237,0.07165337904637517%,up,
EFU,ProShares UltraShort MSCI EAFE,$11.1150,0.0095,0.08531350467877219%,up,
EFV,iShares MSCI EAFE Value ETF,$64.0900,-0.0100,-0.015593326056447842%,down,
EFZ,ProShares Short MSCI EAFE,$14.0850,0.0649,0.460773872914448%,up,
EGGQ,NestYield Visionary ETF,$41.8394,-0.6500,-1.5617491590581452%,down,
EGGS,Tidal Trust III NestYield Total Return Guard ETF,$,-0.2654,-0.6888603954588164%,down,
EGGY,NestYield Dynamic Income ETF,$,,,null,
EGUS,iShares Trust iShares ESG Aware MSCI USA Growth ETF,$45.3351,0.0619,0.1370624353714082%,up,
EHLS,Even Herd Long Short ETF,$21.4050,-0.2099,-0.967945732323116%,down,
EIDO,iShares MSCI Indonesia ETF,$18.8400,0.0800,0.4303388918773534%,up,
EINC,VanEck Energy Income ETF,$96.1757,-1.2969,-1.345468730223612%,down,
EIPI,First Trust Exchange-Traded Fund VIII FT Energy Income Partner,$19.5300,-0.1119,-0.5759135357694287%,down,
EIPX,First Trust Exchange-Traded Fund IV FT Energy Income Partners ,$25.4700,-0.0998,-0.3951630146424131%,down,
EIRL,iShares Trust iShares MSCI Ireland ETF,$67.9400,0.4500,0.6676557863501483%,up,
EIS,iShares Inc iShares MSCI Israel ETF,$86.0400,-0.2295,-0.2662397549898202%,down,
EJAN,Innovator Emerging Markets Power Buffer ETF January,$31.6840,0.1355,0.42847475635439136%,up,
EJUL,Innovator Emerging Markets Power Buffer ETF July,$26.9589,0.2141,0.7990565087090068%,up,
EKG,First Trust Nasdaq Lux Digital Health Solutions ETF,$17.6500,-0.0150,-0.08561643835616438%,down,
ELCV,Strategy Shares Eventide High Dividend ETF,$24.9100,-0.0930,-0.3738392893033726%,down,
ELD,WisdomTree Emerging Markets Local Debt Fund,$27.5500,0.1162,0.4213014662161182%,up,
ELM,Series Portfolios Trust Elm Market Navigator ETF,$25.4500,0.0486,0.1919431279620853%,up,
ELON,Tidal Trust III Battleshares TSLA vs F ETF,$15.1400,0.9862,7.085279114878942%,up,
ELQD,iShares ESG Advanced Investment Grade Corporate Bond ETF,$80.9229,0.2055,0.25449231569431197%,up,
EMB,iShares J.P. Morgan USD Emerging Markets Bond ETF,$91.0600,0.2300,0.2536951246415178%,up,
EMBD,Global X Emerging Markets Bond ETF,$22.9900,0.0500,0.21805494984736154%,up,
EMC,Global X Funds Global X Emerging Markets Great Consumer ETF,$28.7651,0.2270,0.793415004980689%,up,
EMCB,WisdomTree Emerging Markets Corporate Bond Fund,$65.5493,0.0112,0.017109371658325843%,up,
EMCR,Xtrackers Emerging Markets Carbon Reduction and Climate Improv,$32.2668,0.3086,0.960625558367497%,up,
EMCS,Xtrackers MSCI Emerging Markets Climate Selection ETF,$30.5847,0.2456,0.8073343830433483%,up,
EMDM,First Trust Exchange-Traded Fund II First Trust Bloomberg Emer,$24.3395,0.1800,0.7428807263722658%,up,
EMDV,ProShares MSCI Emerging Markets Dividend Growers ETF,$45.7111,0.2321,0.5080631215345651%,up,
EMEQ,Macquarie Focused Emerging Markets Equity ETF,$29.0900,0.2710,0.933484895456581%,up,
EMGF,iShares Emerging Markets Equity Factor ETF,$51.6300,0.5150,1.001458434613515%,up,
EMHC,SPDR Bloomberg Emerging Markets USD Bond ETF,$24.2000,0.0747,0.30976955964619096%,up,
EMHY,iShares J.P. Morgan EM High Yield Bond ETF,$38.4100,0.0950,0.24885396201702686%,up,
EMIF,iShares Emerging Markets Infrastructure ETF,$23.7400,-0.0700,-0.29736618521665253%,down,
EMLC,VanEck J. P. Morgan EM Local Currency Bond ET,$24.7600,0.0200,0.08074283407347597%,up,
EMLP,First Trust North American Energy Infrastructure Fund,$37.0100,-0.2650,-0.7181571815718157%,down,
EMM,Global X Funds Global X Emerging Markets ex-China ETF,$29.2225,0.1757,0.608377394815115%,up,
EMMF,WisdomTree Emerging Markets Multifactor Fund,$28.4851,0.1812,0.6400293876628331%,up,
EMNT,PIMCO Enhanced Short Maturity Active ESG Exchange-Traded Fund,$98.4650,-0.0050,-0.005079597289526886%,down,
EMOT,First Trust Exchange-Traded Fund VI First Trust S&P 500 Econom,$22.5135,-0.0029,-0.012959677527472282%,down,
EMPB,EA Series Trust Efficient Market Portfolio Plus ETF,$27.5569,0.2225,0.8088262023337817%,up,
EMQQ,EMQQ The Emerging Markets Internet ETF,$40.5800,0.4400,1.074743527112848%,up,
EMSF,Matthews International Funds Matthews Emerging Markets Sustain,$27.0400,0.2973,1.1078360864656192%,up,
EMTL,SPDR DoubleLine Emerging Markets Fixed Income ETF,$42.6859,0.0604,0.14174344436569808%,up,
EMTY,ProShares Decline of the Retail Store ETF,$12.6297,0.0357,0.2826603325415677%,up,
EMXC,iShares MSCI Emerging Markets ex China ETF,$61.8400,0.4300,0.7006680788658954%,up,
EMXF,iShares ESG Advanced MSCI EM ETF,$42.3150,0.5150,1.2225519287833828%,up,
ENFR,Alerian Energy Infrastructure ETF,$31.5600,-0.4100,-1.3028280902446776%,down,
ENOR,iShares Inc iShares MSCI Norway ETF,$28.1952,0.2400,0.8528784648187633%,up,
ENZL,iShares MSCI New Zealand ETF,$45.6500,0.0100,0.02206531332744925%,up,
EOCT,Innovator Emerging Markets Power Buffer ETF - October,$27.8212,0.1541,0.5557038073463971%,up,
EPHE,iShares MSCI Philippines ETF,$27.8200,0.1700,0.604551920341394%,up,
EPI,WisdomTree India Earnings Fund,$47.1900,0.3300,0.7018290089323691%,up,
EPOL,iShares Trust iShares MSCI Poland ETF,$30.8300,0.5400,1.8%,up,
EPP,iShares MSCI Pacific Ex-Japan Index Fund,$49.8300,0.2000,0.40338846308995563%,up,
EPRF,Innovator S&P Investment Grade Preferred ETF,$17.5302,0.0350,0.19977168949771693%,up,
EPS,WisdomTree U.S. LargeCap Fund,$62.7450,0.0900,0.14430014430014432%,up,
EPU,iShares MSCI Peru and Global Exposure ETF,$48.2311,-0.0616,-0.12693179476612404%,down,
EPV,ProShares UltraShort FTSE Europe ETF,$26.7897,-0.0100,-0.037341299477221805%,down,
EQAL,Invesco Russell 1000 Equal Weight ETF,$48.8000,0.0700,0.1442704039571311%,up,
EQIN,Columbia U.S. Equity Income ETF,$44.8300,0.0460,0.10348706411698536%,up,
EQL,ALPS Equal Sector Weight ETF,$43.4100,0.0180,0.04170528266913809%,up,
EQRR,ProShares Equities for Rising Rates ETF,$58.8600,-0.1750,-0.2999657182036339%,down,
EQTY,Valued Advisers Trust Kovitz Core Equity ETF,$24.4000,0.0700,0.2877106452938759%,up,
EQWL,Invesco S&P 100 Equal Weight ETF,$108.2200,0.1500,0.13970382788488403%,up,
ERET,iShares Environmentally Aware Real Estate ETF,$26.9400,0.0028,0.010479041916167664%,up,
ERNZ,TrueShares Active Yield ETF,$22.4103,-0.0133,-0.05965008274767117%,down,
ERTH,Invesco MSCI Sustainable Future ETF,$43.1871,0.2122,0.4967495909189867%,up,
ERX,Direxion Energy Bull 2X Shares,$51.4600,0.2500,0.5032206119162641%,up,
ERY,Direxion Daily Energy Bear 2x Shares,$23.1300,-0.0700,-0.29203170629954117%,down,
ESG,FlexShares STOXX US ESG Select Index Fund,$143.8254,0.1877,0.1313359815108046%,up,
ESGD,iShares ESG Aware MSCI EAFE ETF,$89.7100,0.0200,0.022331397945511387%,up,
ESGE,iShares ESG Aware MSCI EM ETF,$38.5100,0.3100,0.8100339691664489%,up,
ESGG,FlexShares STOXX Global ESG Select Index Fund,$184.2003,0.1639,0.08938173362389214%,up,
ESGU,iShares ESG Aware MSCI USA ETF,$131.8900,0.0600,0.04571776897287412%,up,
ESGV,Vanguard ESG U.S. Stock ETF,$106.8600,0.1400,0.13177710843373497%,up,
ESIX,SSGA Active Trust SPDR S&P SmallCap 600 ESG ETF,$29.6344,0.2908,0.9876476122226487%,up,
ESML,iShares ESG Aware MSCI USA Small-Cap ETF,$41.0050,0.1900,0.4655721636853712%,up,
ESMV,iShares ESG Optimized MSCI USA Min Vol Factor ETF,$28.7365,-0.1443,-0.5027471666033733%,down,
ESPO,VanEck Video Gaming and eSports ETF,$104.9800,-0.3900,-0.3726351996942481%,down,
ETEC,iShares Breakthrough Environmental Solutions ETF,$20.1040,0.2292,1.1510184404001444%,up,
ETH,Grayscale Ethereum Mini Trust (ETH) Common units of fractional,$26.1500,0.9100,3.7402383888203867%,up,
ETHA,iShares Ethereum Trust,$21.0200,0.7500,3.834355828220859%,up,
ETHD,ProShares Trust ProShares UltraShort Ether ETF,$12.8600,-1.2500,-8.24538258575198%,down,
ETHE,Grayscale Ethereum Trust (ETH) Common units of fractional undi,$23.0300,0.8000,3.7365716954694066%,up,
ETHO,Amplify ETF Trust Amplify Etho Climate Leadership U.S. ETF,$58.0610,0.1713,0.29503961419221497%,up,
ETHT,ProShares Trust ProShares Ultra Ether ETF,$9.8900,0.6100,7.10128055878929%,up,
ETHU,Volatility Shares Trust 2x Ether ETF,$71.0700,4.4100,7.138232437682098%,up,
ETHV,VanEck Ethereum ETF VanEck Ethereum ETF,$40.7100,1.4400,3.807509254362771%,up,
ETHW,Bitwise Ethereum ETF Common shares of beneficial interest,$19.9100,0.7000,3.777657852131678%,up,
ETQ,T-Rex 2X Inverse Ether Daily Target ETF,$5.9500,-0.5800,-8.273894436519257%,down,
ETU,T-Rex 2X Long Ether Daily Target ETF,$18.2600,1.1400,7.192429022082019%,up,
EUDG,WisdomTree Europe Quality Dividend Growth Fund,$35.3418,-0.0711,-0.20188711926105338%,down,
EUDV,ProShares MSCI Europe Dividend Growers ETF,$54.8637,0.0358,0.0657807699657499%,up,
EUFN,iShares MSCI Europe Financials ETF,$31.7900,-0.0500,-0.15518311607697083%,down,
EUM,ProShares Short MSCI Emerging Markets,$23.7100,-0.2500,-1.0508617065994115%,down,
EUO,ProShares UltraShort Euro,$29.0600,-0.1300,-0.4462753175420529%,down,
EURL,Direxion Daily FTSE Europe Bull 3X Shares,$33.8398,-0.0200,-0.059084194977843424%,down,
EUSA,iShares MSCI USA Equal Weighted ETF,$97.6100,-0.0400,-0.041109969167523124%,down,
EUSB,iShares ESG Advanced Total USD Bond Market ETF,$42.9000,0.0850,0.19852855307719258%,up,
EUSM,Strategy Shares Eventide US Market ETF,$25.4500,-0.0456,-0.17985044016028778%,down,
EVAV,Direxion Shares ETF Trust Direxion Daily Electric and Autonomo,$20.9176,0.8830,4.251999595506267%,up,
EVHY,Morgan Stanley ETF Trust Eaton Vance High Yield ETF,$52.7407,0.0756,0.14345351043643265%,up,
EVIM,Morgan Stanley ETF Trust Eaton Vance Intermediate Municipal In,$50.9667,0.1251,0.24522103216296315%,up,
EVLN,Morgan Stanley ETF Trust Eaton Vance Floating-Rate ETF,$49.8900,0.0940,0.18833901021839314%,up,
EVMT,Invesco Electric Vehicle Metals Commodity Strategy No K-1 ETF,$15.1600,0.0900,0.5909389363099147%,up,
EVNT,AltShares Event-Driven ETF,$11.3100,0.0700,0.6213936972924989%,up,
EVSB,Morgan Stanley ETF Trust Eaton Vance Ultra-Short Income ETF,$50.8800,0.0429,0.08434919386551318%,up,
EVSD,Eaton Vance Short Duration Income ETF,$50.8200,0.0398,0.07833103719740209%,up,
EVSM,Morgan Stanley ETF Trust Eaton Vance Short Duration Municipal ,$49.9000,0.0710,0.14228171780124646%,up,
EVTR,Morgan Stanley ETF Trust Eaton Vance Total Return Bond ETF,$50.2500,0.0700,0.1395812562313061%,up,
EVUS,iShares Trust iShares ESG Aware MSCI USA Value ETF,$29.5876,-0.0046,-0.015628344380760828%,down,
EVX,VanEck Environmental Services ETF,$37.6344,0.2815,0.7504605401716328%,up,
EVYM,Eaton Vance High Income Municipal ETF,$48.1300,0.2030,0.42112425654972685%,up,
EWA,iShares MSCI Australia Index Fund,$26.7100,0.0700,0.26475037821482605%,up,
EWC,iShares MSCI Canada Index Fund,$45.4300,-0.0900,-0.19867549668874174%,down,
EWD,iShares Inc iShares MSCI Sweden ETF,$45.9400,-0.2300,-0.5009801786103246%,down,
EWG,iShares MSCI Germany Index Fund,$42.1200,-0.2100,-0.49633656346017485%,down,
EWH,iShares MSCI Hong Kong Index Fund,$19.8800,0.1900,0.9625126646403243%,up,
EWI,iShares Inc iShares MSCI Italy ETF,$47.9300,-0.1200,-0.24906600249066002%,down,
EWJ,iShares MSCI Japan Index Fund,$73.8800,0.1100,0.14878939537400243%,up,
EWJV,iShares MSCI Japan Value ETF,$34.9200,-0.0900,-0.2575107296137339%,down,
EWK,iShares Inc iShares MSCI Belgium ETF,$22.3136,0.0000,0%,unch,
EWL,iShares Inc iShares MSCI Switzerland ETF,$55.6700,-0.0200,-0.03595828838547285%,down,
EWM,iShares MSCI Malaysia Index Fund,$24.2800,0.0700,0.2878289473684211%,up,
EWN,iShares MSCI Netherlands Index Fund,$54.5700,0.3900,0.7219548315438726%,up,
EWO,iShares Inc iShares MSCI Austria ETF,$29.2800,-0.0030,-0.010187795021564167%,down,
EWP,iShares Inc iShares MSCI Spain ETF,$43.5000,-0.1400,-0.32183908045977017%,down,
EWQ,iShares MSCI France Index Fund,$43.2100,0.0400,0.09285051067780874%,up,
EWS,iShares Inc iShares MSCI Singapore ETF,$25.8900,-0.1000,-0.3815337657382678%,down,
EWT,iShares Inc iShares MSCI Taiwan ETF,$55.8000,0.6000,1.0966916468652896%,up,
EWU,iShares MSCI United Kingdom ETF,$40.3100,-0.0100,-0.024789291026276646%,down,
EWUS,iShares MSCI United Kingdom Small Cap ETF,$41.1849,0.1939,0.47322114973947216%,up,
EWV,ProShares UltraShort MSCI Japan,$33.6800,-0.0677,-0.20136523847057597%,down,
EWW,iShares Inc iShares MSCI Mexico ETF,$61.3600,-0.1500,-0.2455393681453593%,down,
EWX,SPDR S&P Emerging Markets Small Cap ETF,$61.6700,0.5000,0.8147303242626691%,up,
EWY,iShares Inc iShares MSCI South Korea ETF,$66.1600,0.9100,1.368832731648616%,up,
EWZ,iShares Inc iShares MSCI Brazil ETF,$27.7200,-0.1000,-0.3620564808110065%,down,
EWZS,iShares MSCI Brazil Small-Cap ETF,$12.9500,0.0300,0.23492560689115113%,up,
EXI,iShares Global Industrials ETF,$162.1400,-0.2100,-0.1290719114935464%,down,
EYEG,AB Corporate Bond ETF,$35.0343,0.0900,0.2573634543894767%,up,
EYLD,Cambria ETF Trust Cambria Emerging Shareholder Yield ETF,$35.5200,0.2500,0.7084159818645509%,up,
EZA,iShares MSCI South Africa Index Fund,$54.6600,0.5000,0.9184423218221897%,up,
EZBC,Franklin Templeton Digital Holdings Trust Shares of Franklin B,$63.4900,2.5600,4.064137164629306%,up,
EZET,Franklin Ethereum ETF Franklin Ethereum ETF,$21.0900,0.7400,3.771661569826707%,up,
EZJ,ProShares Ultra MSCI Japan,$42.2047,-0.0854,-0.20243874687097022%,down,
EZM,WisdomTree U.S. MidCap Fund,$61.3900,0.1200,0.19668906736600558%,up,
EZU,iShares MSCI Eurozone ETF,$59.7000,-0.0300,-0.05025967498743508%,down,
FAAR,First Trust Alternative Absolute Return Strategy ETF,$27.4300,0.2850,1.0369292341277059%,up,
FAB,First Trust Multi Cap Value AlphaDEX Fund,$80.9900,0.4095,0.5109170305676854%,up,
FAD,First Trust Multi Cap Growth AlphaDEX Fund,$141.7302,-0.6569,-0.4615155470810494%,down,
FAI,First Trust Exchange-Traded Fund II First Trust Bloomberg Arti,$33.3085,0.2449,0.7389861194930598%,up,
FALN,iShares Fallen Angels USD Bond ETF,$26.6800,0.0800,0.30086498683715684%,up,
FAN,First Trust Global Wind Energy ETF,$17.8200,0.0060,0.03400204012240734%,up,
FAPR,FT Vest U.S. Equity Buffer ETF - April,$41.6607,0.0538,0.12923372567859714%,up,
FARX,The Advisors' Inner Circle Fund II Frontier Asset Absolute Ret,$25.3643,0.0389,0.15333735400431237%,up,
FAS,Direxion Financial Bull 3X Shares,$156.9900,-2.9100,-1.8622808140279024%,down,
FAUG,FT Vest U.S. Equity Buffer ETF - August,$48.0011,0.0350,0.07314524555903867%,up,
FAZ,Direxion Financial Bear 3X Shares,$4.8200,0.0900,1.8633540372670807%,up,
FBCG,Fidelity Blue Chip Growth ETF,$46.3200,0.1000,0.21677866897897247%,up,
FBCV,Fidelity Blue Chip Value ETF,$32.4044,-0.0653,-0.20213276377087488%,down,
FBL,GraniteShares 2x Long META Daily ETF,$41.8800,-0.4100,-1.0021999511121975%,down,
FBND,Fidelity Total Bond ETF,$45.1800,0.0900,0.19955654101995565%,up,
FBOT,Fidelity Disruptive Automation ETF,$29.3222,-0.0500,-0.17105713308244955%,down,
FBT,First Trust Amex Biotech Index Fund,$165.4600,0.9100,0.5495335004076211%,up,
FBTC,Fidelity Wise Origin Bitcoin Fund Common Shares of Beneficial ,$95.6700,3.8100,4.0164452877925365%,up,
FBUF,Fidelity Dynamic Buffered Equity ETF,$27.5631,0.0352,0.12781408859840232%,up,
FBY,Tidal ETF Trust II YieldMax META Option Income Strategy ETF,$16.9000,0.0000,0%,unch,
FBZ,First Trust Brazil AlphaDEX Fund,$11.5850,0.0400,0.3454231433506045%,up,
FCA,First Trust China AlphaDEX Fund,$23.4800,0.1800,0.7758620689655172%,up,
FCAL,First Trust California Municipal High Income ETF,$47.8450,0.0200,0.04180602006688963%,up,
FCBD,The Advisors' Inner Circle Fund II Frontier Asset Core Bond ET,$25.4252,0.0192,0.07559174160222995%,up,
FCEF,First Trust Income Opportunities ETF,$22.0850,0.1100,0.49864007252946513%,up,
FCFY,First Trust Exchange-Traded Fund First Trust S&P 500 Diversifi,$24.5266,0.1493,0.6148005089708165%,up,
FCG,First Trust Natural Gas ETF,$23.4600,0.1500,0.6476683937823834%,up,
FCLD,Fidelity Cloud Computing ETF,$27.7722,0.1736,0.6162584309549165%,up,
FCOM,Fidelity MSCI Communication Services Index ETF,$62.9600,0.0100,0.01608492842206852%,up,
FCOR,Fidelity Corporate Bond ETF,$46.6800,0.1350,0.2898861928280009%,up,
FCPI,Fidelity Stocks for Inflation ETF,$45.5800,-0.0621,-0.13561913081458835%,down,
FCSH,Federated Hermes ETF Trust Federated Hermes Short Duration Cor,$24.1350,0.0050,0.02072538860103627%,up,
FCTE,SMI 3Fourteen Full-Cycle Trend ETF,$26.2800,-0.2700,-1.026615969581749%,down,
FCTR,First Trust Lunt U.S. Factor Rotation ETF,$33.1200,-0.3076,-0.9243427280130536%,down,
FCUS,Tidal ETF Trust II Pinnacle Focused Opportunities ETF,$24.7023,-0.1812,-0.7256708049659593%,down,
FCVT,First Trust SSI Strategic Convertible Securities ETF,$37.7700,0.3100,0.8211920529801324%,up,
FDAT,Tactical Advantage ETF,$21.0072,0.0200,0.09523809523809523%,up,
FDCE,Foundations Dynamic Core ETF,$12.6049,0.0049,0.038889197533313755%,up,
FDCF,Fidelity Disruptive Communications ETF,$41.8000,0.2100,0.4997620180866254%,up,
FDD,First Trust Dow Jones STOXX Select Dividend 30 Index Fund,$15.3900,0.0600,0.3898635477582846%,up,
FDEC,FT Vest U.S. Equity Buffer ETF - December,$45.7287,-0.0249,-0.05467720685111989%,down,
FDEM,Fidelity Emerging Markets Multifactor ETF,$27.8100,0.2000,0.7243752263672583%,up,
FDEV,Fidelity Emerging Markets Multifactor ETF,$32.2750,0.0400,0.12449424214130095%,up,
FDFF,Fidelity Disruptive Finance ETF,$37.9300,-0.1999,-0.528276955602537%,down,
FDG,American Century Focused Dynamic Growth ETF,$105.1220,0.7090,0.6756460567618924%,up,
FDGR,Foundations Dynamic Growth ETF,$14.1700,-0.0149,-0.10515172900494002%,down,
FDHT,Fidelity Digital Health ETF,$20.8093,-0.0102,-0.04912561226406461%,down,
FDHY,Fidelity Enhanced High Yield ETF,$48.5400,0.0200,0.041330853482124404%,up,
FDIF,Fidelity Disruptors ETF,$33.0000,0.1000,0.3042287800425921%,up,
FDIG,Fidelity Crypto Industry and Digital Payments ETF,$33.0900,0.1400,0.426959438853309%,up,
FDIS,Fidelity MSCI Consumer Discretionary Index ETF,$93.7000,0.8900,0.9602934829520932%,up,
FDIV,MarketDesk Focused U.S. Dividend ETF,$26.4650,0.1465,0.5593738067964871%,up,
FDL,First Trust Morningstar ETF,$42.4900,0.0700,0.166034155597723%,up,
FDLO,Fidelity Low Volatility Factor ETF,$61.9500,-0.1300,-0.2106969205834684%,down,
FDLS,Northern Lights Fund Trust IV Inspire Fidelis Multi Factor ETF,$30.8204,-0.0628,-0.20376378974691756%,down,
FDM,First Trust DJ Select MicroCap ETF,$69.0993,0.5910,0.8521707282959613%,up,
FDMO,Fidelity Momentum Factor ETF,$73.1027,-0.2730,-0.37328228618308607%,down,
FDN,First Trust DJ Internet Index Fund,$259.7600,-0.3900,-0.14975808309653635%,down,
FDND,First Trust Exchange-Traded Fund IV FT Vest Dow Jones Internet,$22.9795,-0.0150,-0.06494912318683699%,down,
FDNI,First Trust Dow Jones International Internet ETF,$33.3300,0.3350,0.9994033412887827%,up,
FDRR,Fidelity Dividend ETF for Rising Rates,$52.9000,0.2811,0.5339690560088141%,up,
FDRV,Fidelity Electric Vehicles and Future Transportation ETF,$14.6984,0.2399,1.6590250548052254%,up,
FDT,First Trust Developed Markets Ex-US AlphaDEX Fund,$66.8400,-0.0900,-0.1341881616221858%,down,
FDTB,Foundations Dynamic Income ETF,$9.5250,0.0000,0%,unch,
FDTS,First Trust Developed Markets Ex-US Small Cap AlphaDEX Fund,$48.8596,0.1210,0.24719252620547214%,up,
FDTX,Fidelity Disruptive Technology ETF,$37.2700,0.0123,0.03309805905447187%,up,
FDV,Federated Hermes ETF Trust Federated Hermes U.S. Strategic Div,$27.5500,0.1500,0.5470459518599562%,up,
FDVL,Foundations Dynamic Value ETF,$10.3349,-0.0203,-0.19652451715959146%,down,
FDVV,Fidelity High Dividend ETF,$51.3700,0.0200,0.03920031360250882%,up,
FDWM,Fidelity Women's Leadership ETF,$23.5115,0.0127,0.05421419301960249%,up,
FEAC,Fidelity Covington Trust Fidelity Enhanced U.S. All-Cap Equity,$25.5459,0.0450,0.17634334441030786%,up,
FEAT,YieldMax Dorsey Wright Featured 5 Income ETF,$36.7000,0.1100,0.2998909487459106%,up,
FEBP,PGIM S&P 500 Buffer 12 ETF - February,$28.9158,0.0114,0.03954447539397051%,up,
FEBT,AIM ETF Products Trust AllianzIM U.S. Large Cap Buffer10 Feb E,$34.3986,0.0234,0.06818698386241381%,up,
FEBW,AIM ETF Products Trust AllianzIM U.S. Large Cap Buffer20 Feb E,$31.4600,0.0096,0.030532700203869383%,up,
FEBZ,TrueShares Structured Outcome (February) ETF,$35.1962,0.0188,0.05359927697996585%,up,
FEDM,FlexShares ESG & Climate Developed Markets ex-US Core Index Fu,$55.9128,0.0820,0.1468620768088662%,up,
FEGE,The RBB Fund Trust First Eagle Global Equity ETF,$39.7220,0.0900,0.22664316293125156%,up,
FEIG,FlexShares ESG & Climate Investment Grade Corporate Core Index,$40.4868,0.1007,0.24901088031651833%,up,
FELC,Fidelity Covington Trust Fidelity Enhanced Large Cap Core ETF,$33.6300,0.0100,0.02987750224081267%,up,
FELG,Fidelity Covington Trust Fidelity Enhanced Large Cap Growth ET,$35.8800,0.0300,0.08405715886803027%,up,
FELV,Fidelity Covington Trust Fidelity Enhanced Large Cap Value ETF,$31.2800,-0.0183,-0.058691468890314305%,down,
FEM,First Trust Emerging Markets AlphaDEX Fund,$24.4300,0.1000,0.41339396444811904%,up,
FEMB,First Trust Emerging Markets Local Currency Bond ETF,$28.2000,0.0600,0.2117896223085069%,up,
FEMR,Fidelity Covington Trust Fidelity Enhanced Emerging Markets ET,$28.0000,0.2161,0.7725389397519724%,up,
FEMS,First Trust Emerging Markets Small Cap AlphaDEX Fund,$40.8000,0.7000,1.7275419545903257%,up,
FENI,Fidelity Covington Trust Fidelity Enhanced International ETF,$32.9800,0.0400,0.12158054711246201%,up,
FENY,Fidelity MSCI Energy Index ETF,$23.5000,0.0400,0.17301038062283736%,up,
FEOE,The RBB Fund Trust First Eagle Overseas Equity ETF,$41.7200,0.1350,0.32292787944025836%,up,
FEP,First Trust Europe AlphaDEX Fund,$46.9950,-0.0476,-0.10069300479772554%,down,
FEPI,REX FANG & Innovation Equity Premium Income ETF,$44.6200,0.3300,0.7440811724915445%,up,
FESM,Fidelity Covington Trust Fidelity Enhanced Small Cap ETF,$31.6100,0.1000,0.31806615776081426%,up,
FEUS,FlexShares ESG & Climate US Large Cap Core Index Fund,$66.6089,0.1171,0.17694274368536528%,up,
FEUZ,First Trust Eurozone AlphaDEX ETF,$53.8206,0.0847,0.1565193930669485%,up,
FEX,First Trust Large Cap Core AlphaDEX Fund,$107.4300,-0.1400,-0.1308288944958415%,down,
FEZ,SPDR DJ Euro STOXX 50 Etf,$60.1600,-0.0800,-0.1332001332001332%,down,
FFEB,FT Vest U.S. Equity Buffer ETF - February,$51.3931,0.0800,0.15609756097560976%,up,
FFIU,UVA Unconstrained Medium-Term Fixed Income ETF,$21.7262,0.0404,0.18651892890120036%,up,
