SYMBOL,NAME,LAST PRICE,NET CHANGE,% CHANGE,DELTA,1 yr % CHANGE
CPNQ,Calamos ETF Trust Calamos Nasdaq-100 Structured Alt Protection,$25.2141,-0.0017,-0.006750880592806738%,down,
CPNS,Calamos ETF Trust Calamos Nasdaq-100 Structured Alt Protection,$26.1199,0.0215,0.08239063122719888%,up,
CPRJ,Calamos ETF Trust Calamos Russell 2000 Structured Alt Protecti,$25.5637,0.1360,0.5337016921483063%,up,
CPRO,Calamos ETF Trust Calamos Russell 2000 Structured Alt Protecti,$24.9169,0.0418,0.1679672745099615%,up,
CPRY,Calamos ETF Trust Calamos Russell 2000 Structured Alt Protecti,$24.9376,0.0500,0.20077660390390029%,up,
CPSA,Calamos ETF Trust Calamos S&P 500 Structured Alt Protection ET,$25.7304,0.0100,0.038925652004671074%,up,
CPSD,Calamos ETF Trust Calamos S&P 500 Structured Alt Protection ET,$24.5141,-0.0015,-0.006125099022434196%,down,
CPSF,Calamos ETF Trust Calamos S&P 500 Structured Alt Protection ET,$24.3601,0.0008,0.0032880000328800005%,up,
CPSJ,Calamos ETF Trust Calamos S&P 500 Structured Alt Protection ET,$25.8367,0.0302,0.1171441649017463%,up,
CPSM,Calamos ETF Trust Calamos S&P 500 Structured Alt Protection ET,$27.6850,-0.0053,-0.019147398843930637%,down,
CPSN,Calamos ETF Trust Calamos S&P 500 Structured Alt Protection ET,$25.8379,0.0085,0.03293884225782201%,up,
CPSO,Calamos ETF Trust Calamos S&P 500 Structured Alt Protection ET,$26.0051,0.0006,0.0023116933153534964%,up,
CPSR,Calamos ETF Trust Calamos S&P 500 Structured Alt Protection ET,$24.0981,0.0341,0.14152842397101364%,up,
CPST,Calamos ETF Trust Calamos S&P 500 Structured Alt Protection ET,$25.8669,-0.0090,-0.03486142583231654%,down,
CPSY,Calamos ETF Trust Calamos S&P 500 Structured Alt Protection ET,$23.9344,-0.0005,-0.0020921289923051495%,down,
CPXR,Tidal Trust III USCF Daily Target 2X Copper Index ETF,$23.8826,0.6917,2.894832658834952%,up,
CQQQ,Invesco China Technology ETF,$43.1200,0.9300,2.129608426837646%,up,
CRAK,VanEck Oil Refiners ETF,$31.3242,0.2209,0.7174150972196511%,up,
CRBN,iShares MSCI ACWI Low Carbon Target ETF,$207.9377,0.2585,0.1247884389424892%,up,
CRDT,Simplify Exchange Traded Funds Simplify Opportunistic Income E,$24.4250,0.0707,0.2895084907476035%,up,
CRED,Columbia ETF Trust I Columbia Research Enhanced Real Estate ET,$21.8456,0.0486,0.22325837793141465%,up,
CRPT,First Trust SkyBridge Crypto Industry and Digital Economy ETF,$21.0600,0.5200,2.4186046511627906%,up,
CRSH,Tidal Trust II YieldMax Short TSLA Option Income Strategy ETF,$4.8000,-0.1500,-2.9761904761904763%,down,
CRTC,DBX ETF Trust Xtrackers US National Critical Technologies ETF,$33.1819,0.1119,0.33880036211370246%,up,
CRWL,GraniteShares 2x Long CRWD Daily ETF,$36.1800,-0.5450,-1.52682448522202%,down,
CSB,VictoryShares US Small Cap High Div Volatility Wtd ETF,$55.8569,0.2784,0.5025352397421619%,up,
CSD,Invesco S&P Spin-Off ETF,$81.7093,0.4600,0.5608388198000488%,up,
CSHI,NEOS Enhanced Income 1-3 Month T-Bill ETF,$49.7800,-0.0240,-0.0482218203737191%,down,
CSHP,iShares Enhanced Short-Term Bond Active ETF,$99.5050,0.0000,0%,unch,
CSM,ProShares Large Cap Core Plus,$68.7500,0.0758,0.11068844415563554%,up,
CSMD,Professionally Managed Portfolios Congress SMid Growth ETF,$30.7810,0.0300,0.09721322099805574%,up,
CSNR,Cohen & Steers ETF Trust Cohen & Steers Natural Resources Acti,$26.3844,0.1738,0.6622037133701902%,up,
CSPF,Cohen & Steers ETF Trust Cohen & Steers Preferred and Income O,$25.3049,0.0317,0.12548640827814436%,up,
CSRE,Cohen & Steers ETF Trust Cohen & Steers Real Estate Active ETF,$26.1100,-0.0150,-0.05790387955993051%,down,
CTA,Simplify Exchange Traded Funds Simplify Managed Futures Strate,$28.1300,0.2400,0.8522727272727273%,up,
CTEC,Global X CleanTech ETF,$6.8900,0.0100,0.14684287812041116%,up,
CTEX,ProShares S&P Kensho Cleantech ETF,$20.8361,0.2313,1.1314773777901703%,up,
CURE,Direxion Daily Healthcare Bull 3x Shares,$80.1600,-0.3600,-0.4642166344294004%,down,
CUT,Invesco MSCI Global Timber ETF,$30.8492,0.2365,0.7677150657183572%,up,
CVAR,ETF Opportunities Trust Cultivar ETF,$26.4781,0.1906,0.7254071376104191%,up,
CVIE,Morgan Stanley ETF Trust Calvert International Responsible Ind,$64.6161,0.0639,0.09908313214340539%,up,
CVLC,Morgan Stanley ETF Trust Calvert US Large-Cap Core Responsible,$74.6300,0.0276,0.037176724137931036%,up,
CVMC,Morgan Stanley ETF Trust Calvert US Mid-Cap Core Responsible I,$60.1500,-0.0821,-0.13699315868513268%,down,
CVNY,Tidal Trust II YieldMax CVNA Option Income Strategy ETF,$45.3000,-0.0200,-0.04402377283733216%,down,
CVRD,Madison ETFs Trust Madison Covered Call ETF,$18.8140,0.1042,0.5578606419145007%,up,
CVRT,Calamos ETF Trust Calamos Convertible Equity Alternative ETF,$31.2726,0.1911,0.6098884264814767%,up,
CVSB,Morgan Stanley ETF Trust Calvert Ultra-Short Investment Grade ,$50.6850,-0.0350,-0.06914263137099962%,down,
CVSE,Morgan Stanley ETF Trust Calvert US Select Equity ETF,$69.4629,-0.0830,-0.11983431101768208%,down,
CVY,Invesco Zacks Multi-Asset Income ETF,$25.7285,0.0215,0.08401226969892346%,up,
CWB,SPDR Bloomberg Convertible Securities ETF,$81.2700,0.1400,0.17228648781688408%,up,
CWEB,Direxion Daily CSI China Internet Index Bull 2X Shares,$41.2200,1.7000,4.104297440849831%,up,
CWI,SPDR MSCI ACWI ex-US ETF,$32.0600,0.0900,0.28125%,up,
CWS,AdvisorShares Focused Equity ETF,$68.4700,-0.3404,-0.4980853563783166%,down,
CXRN,Listed Funds Trust Teucrium 2x Daily Corn ETF,$22.0200,-0.8850,-4.100069492703266%,down,
CXSE,WisdomTree China ex-State-Owned Enterprises Fund,$34.5700,0.5800,1.678726483357453%,up,
CZA,Invesco Zacks Mid-Cap ETF,$105.9377,0.1000,0.094732853353543%,up,
CZAR,Themes Natural Monopoly ETF,$31.5618,-0.1025,-0.3281312525010004%,down,
DABS,DoubleLine ETF Trust DoubleLine Asset-Backed Securities ETF,$50.0835,0.0250,0.050020008003201284%,up,
DALI,First Trust Dorsey Wright DALI Equity ETF,$25.7722,-0.0525,-0.2035499104380394%,down,
DAPP,VanEck Digital Transformation ETF,$15.1500,0.1800,1.1741682974559686%,up,
DAPR,FT Vest U.S. Equity Deep Buffer ETF - April,$37.2500,-0.0144,-0.03867329125822479%,down,
DARP,Grizzle Growth ETF,$33.6093,0.0972,0.2888120968293067%,up,
DAT,ProShares Big Data Refiners ETF,$45.5953,0.0962,0.20869761407862822%,up,
DAUG,FT Vest U.S. Equity Deep Buffer ETF - August,$40.8697,0.0226,0.055465839423940615%,up,
DAX,Global X DAX Germany ETF,$44.2900,-0.2200,-0.4941599281221922%,down,
DBA,Invesco DB Agriculture Fund,$27.0700,-0.0900,-0.32858707557502737%,down,
DBAW,Xtrackers MSCI All World ex US Hedged Equity ETF,$37.0876,0.0636,0.1722191081974671%,up,
DBB,Invesco DB Base Metals Fund,$18.7200,0.1050,0.5630026809651475%,up,
DBC,Invesco DB Commodity Index Tracking Fund,$21.6200,0.0200,0.09229349330872173%,up,
DBE,Invesco DB Energy Fund,$18.3235,0.0796,0.43263220827218873%,up,
DBEF,Xtrackers MSCI EAFE Hedged Equity ETF,$45.5200,-0.0800,-0.1762891141472014%,down,
DBEM,Xtrackers MSCI Emerging Markets Hedged Equity ETF,$27.1102,0.1300,0.4836309523809524%,up,
DBEU,Xtrackers MSCI Europe Hedged Equity ETF,$46.3800,-0.1400,-0.3026372676178124%,down,
DBEZ,Xtrackers MSCI Eurozone Hedged Equity ETF,$53.3235,-0.1266,-0.2372772714238323%,down,
DBJP,Xtrackers MSCI Japan Hedged Equity ETF,$77.8526,-0.0645,-0.08304172170594733%,down,
DBMF,iMGP DBi Managed Futures Strategy ETF,$25.3300,0.0100,0.03949447077409163%,up,
DBND,DoubleLine Opportunistic Core Bond ETF,$45.4700,0.0500,0.11015642211940956%,up,
DBO,Invesco DB Oil Fund,$13.1100,0.0100,0.07627765064836003%,up,
DBP,Invesco DB Precious Metals Fund,$75.7994,0.4450,0.5872649290663147%,up,
DCMT,DoubleLine ETF Trust DoubleLine Commodity Strategy ETF,$25.9746,0.0519,0.19927125848054708%,up,
DCOR,Dimensional ETF Trust Dimensional US Core Equity 1 ETF,$65.5100,0.0300,0.04601932811780948%,up,
DCRE,DoubleLine ETF Trust DoubleLine Commercial Real Estate ETF,$51.6800,0.0100,0.01934610176049526%,up,
DDEC,FT Vest U.S. Equity Deep Buffer ETF - December,$41.0082,0.0206,0.05036256154745083%,up,
DDIV,First Trust Dorsey Wright Momentum & Dividend ETF,$37.5046,-0.1976,-0.5267591516405241%,down,
DDLS,WisdomTree Dynamic International SmallCap Equity Fund,$38.8400,-0.1900,-0.48931238732938453%,down,
DDM,ProShares Ultra Dow30,$93.3200,-0.0200,-0.021554046772281496%,down,
DDWM,WisdomTree Dynamic International Equity Fund,$39.8000,0.0000,0%,unch,
DECO,SPDR Galaxy Digital Asset Ecosystem ETF,$32.7000,1.0274,3.1428571428571432%,up,
DECP,PGIM S&P 500 Buffer 12 ETF - December,$27.2146,0.0112,0.0412696307105009%,up,
DECT,AIM ETF Products Trust AllianzIM U.S. Large Cap Buffer10 Dec E,$32.6709,0.0226,0.06936771025168816%,up,
DECW,AIM ETF Products Trust AllianzIM U.S. Large Cap Buffer20 Dec E,$31.0677,-0.0050,-0.016134236850596968%,down,
DECZ,TrueShares Structured Outcome (December) ETF,$37.6609,0.0190,0.05056997687088952%,up,
DEED,First Trust Securitized Plus ETF,$20.8550,0.0498,0.23907825252040327%,up,
DEEF,Xtrackers FTSE Developed ex US Multifactor ETF,$33.2482,-0.0740,-0.2225563909774436%,down,
DEEP,Acquirers Small and Micro Deep Value ETF,$32.7569,0.3295,1.0169501987605247%,up,
DEFI,Tidal Commodities Trust I Hashdex Bitcoin ETF,$124.7681,3.8050,3.0845932471322604%,up,
DEHP,Dimensional ETF Trust Dimensional Emerging Markets High Profit,$27.5800,0.2600,0.9489051094890512%,up,
DEM,WisdomTree Emerging Markets High Dividend Fund,$45.0900,0.2200,0.49140049140049136%,up,
DEMZ,Democratic Large Cap Core ETF,$37.9000,0.1400,0.37095919448860626%,up,
DES,WisdomTree U.S. SmallCap Dividend Fund,$32.0300,0.2500,0.785175879396985%,up,
DESK,VanEck ETF Trust VanEck Office and Commercial REIT ETF,$41.1179,0.0416,0.1023438211148096%,up,
DEUS,Xtrackers Russell US Multifactor ETF,$55.4111,-0.1196,-0.21594333473564092%,down,
DEW,WisdomTree Global High Dividend Fund,$57.2914,0.1600,0.280294589613684%,up,
DEXC,Dimensional ETF Trust Dimensional Emerging Markets ex China Co,$53.5719,0.3619,0.6798388975301128%,up,
DFAC,Dimensional ETF Trust Dimensional U.S. Core Equity 2 ETF,$35.1500,0.0300,0.08578781812982557%,up,
DFAE,Dimensional Emerging Core Equity Market ETF,$28.5200,0.2100,0.7412636780797741%,up,
DFAI,Dimensional International Core Equity Market ETF,$34.4600,0.0200,0.05813953488372093%,up,
DFAR,Dimensional ETF Trust Dimensional US Real Estate ETF,$23.8500,0.0400,0.16891891891891891%,up,
DFAS,Dimensional U.S. Small Cap ETF,$63.2300,0.3000,0.47679593134138587%,up,
DFAT,Dimensional U.S. Targeted Value ETF,$53.7000,0.3700,0.6956194773453657%,up,
DFAU,Dimensional US Core Equity Market ETF,$41.4000,0.0400,0.09718172983479106%,up,
DFAW,Dimensional ETF Trust Dimensional World Equity ETF,$65.9000,0.0770,0.11727078891257997%,up,
DFAX,Dimensional World ex U.S. Core Equity 2 ETF,$29.1400,0.1000,0.3441156228492774%,up,
DFCA,Dimensional ETF Trust Dimensional California Municipal Bond ET,$49.1030,0.1550,0.31529698942229456%,up,
DFCF,Dimensional ETF Trust Dimensional Core Fixed Income ETF,$41.6600,0.1000,0.2402691013935608%,up,
DFE,WisdomTree Europe SmallCap Dividend Fund,$70.0725,0.0396,0.056661520388846844%,up,
DFEB,FT Vest U.S. Equity Deep Buffer ETF - February,$43.9400,0.0100,0.022825838849577722%,up,
DFEM,Dimensional ETF Trust Dimensional Emerging Markets Core Equity,$29.2600,0.2500,0.8602890571231935%,up,
DFEN,Direxion Daily Aerospace & Defense Bull 3X Shares,$44.8500,0.8100,1.6963350785340314%,up,
DFEV,Dimensional ETF Trust Dimensional Emerging Markets Value ETF,$29.5500,0.2400,0.8171603677221655%,up,
DFGP,Dimensional Global Core Plus Fixed Income ETF,$53.8400,0.1350,0.2512095273539263%,up,
DFGR,Dimensional ETF Trust Dimensional Global Real Estate ETF,$27.1000,0.0800,0.2969561989606533%,up,
DFGX,Dimensional Global ex US Core Fixed Income ETF,$53.1300,0.0300,0.056614455557652384%,up,
DFIC,Dimensional ETF Trust Dimensional International Core Equity 2 ,$30.8600,0.0100,0.03244646333549643%,up,
DFIP,Dimensional ETF Trust Dimensional Inflation-Protected Securiti,$41.2400,0.0500,0.12125621438098702%,up,
DFIS,Dimensional ETF Trust Dimensional International Small Cap ETF,$29.3500,0.0900,0.30716723549488056%,up,
DFIV,Dimensional International Value ETF,$42.7800,-0.0100,-0.023419203747072598%,down,
DFJ,WisdomTree Japan SmallCap Fund,$84.6562,-0.4716,-0.5561320754716982%,down,
DFLV,Dimensional ETF Trust Dimensional US Large Cap Value ETF,$30.6000,0.0600,0.19743336623889438%,up,
DFND,Siren DIVCON Dividend Defender ETF,$42.8500,-0.3500,-0.8149010477299184%,down,
DFNL,Davis Fundamental ETF Trust Davis Select Financial ETF,$41.3590,0.0560,0.13529511246406226%,up,
DFNM,Dimensional ETF Trust Dimensional National Municipal Bond ETF,$47.2800,0.1100,0.23255813953488375%,up,
DFSB,Dimensional ETF Trust Dimensional Global Sustainability Fixed ,$51.7800,0.0800,0.15473887814313345%,up,
DFSD,Dimensional ETF Trust Dimensional Short-Duration Fixed Income ,$47.7000,0.0400,0.08391021606880637%,up,
DFSE,Dimensional ETF Trust Dimensional Emerging Markets Sustainabil,$37.3900,0.2700,0.7265877287405813%,up,
DFSI,Dimensional ETF Trust Dimensional International Sustainability,$39.1600,0.0300,0.07666751852798363%,up,
DFSU,Dimensional ETF Trust Dimensional US Sustainability Core 1 ETF,$38.4200,0.0500,0.1306506401881369%,up,
DFSV,Dimensional ETF Trust Dimensional US Small Cap Value ETF,$29.3600,0.2500,0.8617718028266115%,up,
DFUS,Dimensional U.S. Equity Market ETF,$65.3900,0.0500,0.07684032580298142%,up,
DFUV,Dimensional ETF Trust Dimensional US Marketwide Value ETF,$41.5900,0.1500,0.36284470246734396%,up,
DFVE,DoubleLine ETF Trust DoubleLine Fortune 500 Equal Weight ETF,$29.1088,0.0281,0.09710616710554508%,up,
DFVX,Dimensional ETF Trust Dimensional US Large Cap Vector ETF,$67.8400,0.0600,0.08894159501927068%,up,
DGCB,Dimensional Global Credit ETF,$53.4900,0.1250,0.2341262408690766%,up,
DGIN,VanEck ETF Trust VanEck Digital India ETF,$43.4091,0.2580,0.5951227613696127%,up,
DGP,NO Name,$101.5300,1.4400,1.4153725181836054%,up,
DGRE,WisdomTree Emerging Markets Quality Dividend Growth Fund,$27.2472,0.1000,0.37064492216456635%,up,
DGRO,iShares Core Dividend Growth ETF,$63.1300,-0.0600,-0.09558706388402102%,down,
DGRS,WisdomTree U.S. SmallCap Quality Dividend Growth Fund,$47.0000,0.3494,0.7481894842332021%,up,
DGRW,WisdomTree U.S. Quality Dividend Growth Fund,$82.4600,-0.0400,-0.04877453969028167%,down,
DGS,WisdomTree Emerging Market SmallCap Fund,$54.6300,0.2300,0.42404129793510326%,up,
DGT,SPDR Global Dow ETF (based on The Global Dow),$148.9300,0.1567,0.10553247430213537%,up,
DGZ,NO Name,$6.9250,-0.0778,-1.129992737835875%,down,
DHS,WisdomTree U.S. High Dividend Fund,$95.9100,0.0607,0.06372656578901782%,up,
DHSB,Strategy Shares Day Hagan Smart Buffer ETF,$24.9898,0.0150,0.06008315508663991%,up,
DIA,SPDR Dow Jones Industrial Average ETF,$429.6100,-0.0200,-0.004668970025212438%,down,
DIAL,Columbia Diversified Fixed Income Allocation ETF,$17.9250,0.0200,0.11176306230790724%,up,
DIEM,Franklin Emerging Market Core Dividend Tilt Index ETF,$29.6281,0.1937,0.6590520130517478%,up,
DIG,ProShares Ultra Energy,$33.3300,0.1100,0.3419334783960211%,up,
DIHP,Dimensional ETF Trust Dimensional International High Profitabi,$29.4750,0.0500,0.17001020061203673%,up,
DIM,WisdomTree International MidCap Dividend Fund,$74.4869,0.2017,0.2709502872717845%,up,
DINT,Davis Fundamental ETF Trust Davis Select International ETF,$25.3111,0.3800,1.4913657770800628%,up,
DIPS,Tidal Trust II YieldMax Short NVDA Option Income Strategy ETF,$8.4300,-0.0064,-0.07547169811320754%,down,
DISO,Tidal ETF Trust II YieldMax DIS Option Income Strategy ETF,$14.3722,0.0908,0.6421136003620729%,up,
DISV,Dimensional ETF Trust Dimensional International Small Cap Valu,$32.5700,0.0000,0%,unch,
DIV,Global X Super Dividend ETF,$17.8000,0.1200,0.6779661016949153%,up,
DIVB,iShares Core Dividend ETF,$49.7200,0.0750,0.15174506828528073%,up,
DIVD,Altrius Global Dividend ETF,$35.4400,0.0425,0.1202858557984858%,up,
DIVG,Invesco Exchange-Traded Fund Trust II Invesco S&P 500 High Div,$30.9059,0.0535,0.17456391649645325%,up,
DIVI,Franklin International Core Dividend Tilt Index ETF,$35.9500,0.0400,0.11226494527083918%,up,
DIVL,Madison ETFs Trust Madison Dividend Value ETF,$22.0011,-0.0146,-0.06663106924611052%,down,
DIVO,Amplify CWP Enhanced Dividend Income ETF,$41.6900,-0.0600,-0.14423076923076922%,down,
DIVP,The Advisors Inner Circle Fund II Cullen Enhanced Equity Incom,$25.2700,0.0853,0.3413010251034306%,up,
DIVS,SmartETFs Dividend Builder ETF,$30.7100,-0.0708,-0.2313475997686524%,down,
DIVY,Sound Equity Dividend Income ETF,$25.3358,0.0597,0.23808859128922782%,up,
DIVZ,Opal Dividend Income ETF,$34.4794,-0.0722,-0.2097343461778675%,down,
DJAN,FT Vest U.S. Equity Deep Buffer ETF - January,$39.6372,0.0300,0.07577671129072998%,up,
DJD,Invesco Dow Jones Industrial Average Dividend ETF,$52.5900,-0.0463,-0.08859717943320768%,down,
DJIA,Global X Funds Global X Dow 30 Covered Call ETF,$21.5820,0.0432,0.2006204372782494%,up,
DJP,NO Name,$34.1600,-0.0094,-0.027364878633852105%,down,
DJUL,FT Vest U.S. Equity Deep Buffer ETF - July,$43.3589,0.0314,0.07272070386230312%,up,
DJUN,FT Vest U.S. Equity Deep Buffer ETF - June,$44.7393,0.0100,0.022461966275603835%,up,
DLLL,GraniteShares 2x Long DELL Daily ETF,$21.2600,0.2150,0.996062080148251%,up,
DLN,WisdomTree U.S. LargeCap Dividend Fund,$80.8200,-0.0700,-0.08707550690384377%,down,
DLS,WisdomTree International SmallCap Fund,$73.6800,-0.1900,-0.25829255029907555%,down,
DMAR,FT Vest U.S. Equity Deep Buffer ETF - March,$39.0900,-0.0600,-0.15404364569961487%,down,
DMAT,Global X Disruptive Materials ETF,$15.9800,0.2960,1.835545082475505%,up,
DMAY,FT Vest U.S. Equity Deep Buffer ETF - May,$42.2097,0.0046,0.010917704244138854%,up,
DMBS,DoubleLine ETF Trust DoubleLine Mortgage ETF,$48.2200,0.0850,0.17678868552412647%,up,
DMCY,Democracy International Fund,$28.3708,0.0872,0.3082513804147254%,up,
DMX,DoubleLine ETF Trust DoubleLine Multi-Sector Income ETF,$49.9600,0.0304,0.06090963734722501%,up,
DMXF,iShares ESG Advanced MSCI EAFE ETF,$74.7300,0.2200,0.2948666398606085%,up,
DNL,WisdomTree Global ex-US Quality Dividend Growth Fund,$40.0000,0.2200,0.5558362809499747%,up,
DNOV,FT Vest U.S. Equity Deep Buffer ETF - November,$43.9200,0.0210,0.04800219438602908%,up,
DOCT,FT Vest U.S. Equity Deep Buffer ETF - October,$40.2151,0.0245,0.061071822956524344%,up,
DOG,ProShares Short Dow30,$26.3400,0.0100,0.03786444528587656%,up,
DOL,WisdomTree International LargeCap Dividend Fund,$59.9875,0.0162,0.027%,up,
DON,WisdomTree U.S. MidCap Dividend Fund,$49.8600,0.1600,0.32245062474808545%,up,
DPST,Direxion Daily Regional Banks Bull 3X Shares,$84.4900,1.1800,1.4397266959492436%,up,
DRAI,EA Series Trust Draco Evolution AI ETF,$26.2900,0.1350,0.5194925135356661%,up,
DRIP,Direxion Daily S&P Oil & Gas Exp. & Prod. Bear 2X Shares,$9.9200,-0.1800,-1.7595307917888563%,down,
DRIV,Global X Autonomous & Electric Vehicles ETF,$23.0700,0.3100,1.363236587510994%,up,
DRLL,EA Series Trust Strive U.S. Energy ETF,$27.3325,0.0800,0.29795158286778395%,up,
DRN,Direxion Daily Real Estate Bull 3X Shares,$10.0000,-0.0100,-0.1026694045174538%,down,
DRSK,Aptus Defined Risk ETF,$28.2400,0.0300,0.10664770707429791%,up,
DRUP,GraniteShares Nasdaq Select Disruptors ETF,$60.4286,0.0022,0.003651361376895181%,up,
DRV,Direxion Daily Real Estate Bear 3X Shares,$24.6400,0.0200,0.07908264136022143%,up,
DSCF,Discipline Fund ETF,$23.3200,0.0450,0.19338203695745596%,up,
DSEP,FT Vest U.S. Equity Deep Buffer ETF - September,$41.6415,0.0061,0.014696033034754911%,up,
DSI,iShares ESG MSCI KLD 400 ETF,$113.4500,0.3600,0.3194888178913738%,up,
DSMC,ETF Series Solutions Distillate Small/Mid Cash Flow ETF,$32.4100,0.3698,1.1410269859978897%,up,
DSTL,Distillate U.S. Fundamental Stability & Value ETF,$54.9700,0.0960,0.17585638395310493%,up,
DSTX,Distillate International Fundamental Stability & Value ETF,$27.8485,0.1079,0.3894997509223094%,up,
DTAN,EA Series Trust Sparkline International Intangible Value ETF,$28.7600,0.0094,0.032938191833430865%,up,
DTCR,Global X Data Center & Digital Infrastructure ETF,$18.2500,0.0500,0.2762430939226519%,up,
DTD,WisdomTree U.S. Total Dividend Fund,$78.2300,-0.0400,-0.05132811497497754%,down,
DTEC,ALPS ETF Trust ALPS Disruptive Technologies ETF,$48.4636,0.0204,0.04230188616645377%,up,
DTH,WisdomTree International High Dividend Fund,$46.3100,-0.0800,-0.1731976618315653%,down,
DTRE,First Trust Alerian Disruptive Technology Real Estate ETF,$40.4939,0.1085,0.269109236027402%,up,
DUBS,ETF Series Solutions Aptus Large Cap Enhanced Yield ETF,$33.0300,0.0100,0.030422878004259205%,up,
DUG,ProShares UltraShort Energy,$38.1100,-0.1400,-0.35469977197871805%,down,
DUHP,Dimensional ETF Trust Dimensional US High Profitability ETF,$35.1000,-0.1100,-0.3153669724770642%,down,
DUKH,Ocean Park High Income ETF,$24.0600,0.0406,0.1689020534495956%,up,
DUKQ,Northern Lights Fund Trust Ocean Park Domestic ETF,$25.2892,0.0528,0.20966358524730774%,up,
DUKX,Ocean Park International ETF,$23.6807,0.0880,0.3732118698338783%,up,
DUKZ,Northern Lights Fund Trust Ocean Park Diversified Income ETF,$24.6550,0.0507,0.20584987169909377%,up,
DULL,Bank Of Montreal MicroSectors Gold -3X Inverse Leveraged ETNs ,$3.9400,-0.0400,-1.0101010101010102%,down,
DURA,VanEck Durable High Dividend ETF,$32.7100,0.1687,0.5208397653596788%,up,
DUSA,Davis Fundamental ETF Trust Davis Select U.S. Equity ETF,$45.0500,0.2000,0.447127207690588%,up,
DUSB,Dimensional ETF Trust Dimensional Ultrashort Fixed Income ETF,$50.8100,0.0160,0.03151095005514416%,up,
DUSL,Direxion Daily Industrials Bull 3X Shares,$63.5508,-0.1630,-0.2523766760598272%,down,
DUST,Direxion Daily Gold Miners Index Bear 2X Shares,$25.6200,-0.4300,-1.7179384738314023%,down,
DVAL,BrandywineGLOBAL-Dynamic US Large Cap Value ETF,$13.9097,-0.0127,-0.0918958031837916%,down,
DVDN,ETF Opportunities Trust Kingsbarn Dividend Opportunity ETF,$23.0300,0.1428,0.6259314456035768%,up,
DVLU,First Trust Dorsey Wright Momentum & Value ETF,$29.0200,-0.2000,-0.6884681583476764%,down,
DVND,Touchstone ETF Trust Touchstone Dividend Select ETF,$32.4121,0.1432,0.44490287944126167%,up,
DVOL,First Trust Dorsey Wright Momentum & Low Volatility ETF,$34.8138,-0.4860,-1.3949483352468426%,down,
DVQQ,WEBs Defined Volatility QQQ ETF,$22.4125,0.0417,0.18730376898303486%,up,
DVSP,WEBs Defined Volatility SPY ETF,$22.3398,0.0319,0.14358632734081722%,up,
DVY,iShares Select Dividend ETF,$132.5400,-0.0600,-0.045596169921726576%,down,
DVYA,iShares Asia / Pacific Dividend 30 Index Fund Exchange Traded ,$38.5250,0.0888,0.2319858300547048%,up,
DVYE,iShares Emerging Markets Dividend Index Fund Exchange Traded F,$28.8200,0.1100,0.38501925096254813%,up,
DWAS,Invesco Dorsey Wright SmallCap Momentum ETF,$83.5000,-0.3300,-0.39592081583683264%,down,
DWAT,Arrow Investments Trust Arrow DWA Tactical ETF,$12.2100,-0.0093,-0.07622950819672131%,down,
DWAW,AdvisorShares Dorsey Wright FSM All Cap World ETF,$40.5800,-0.1343,-0.33158692614228363%,down,
DWCR,Arrow Investments Trust Arrow DWA Country Rotation ETF,$32.5863,0.0845,0.26015128797977904%,up,
DWLD,Davis Fundamental ETF Trust Davis Select Worldwide ETF,$40.9050,0.2741,0.6711705204081383%,up,
DWM,WisdomTree International Equity Fund,$63.5200,-0.0128,-0.020210122113347207%,down,
DWMF,WisdomTree International Multifactor Fund,$31.6759,-0.0981,-0.30974415322389676%,down,
DWSH,AdvisorShares Dorsey Wright Short ETF,$7.2650,-0.1500,-2.0026702269692924%,down,
DWUS,AdvisorShares Dorsey Wright FSM US Core ETF,$49.6500,-0.3600,-0.7252215954875101%,down,
DWX,SPDR S&P International Dividend ETF,$41.9100,-0.0300,-0.071616137502984%,down,
DXD,ProShares UltraShort Dow30,$25.7500,0.0000,0%,unch,
DXIV,Dimensional ETF Trust Dimensional International Vector Equity ,$57.4896,-0.1037,-0.18075239710447558%,down,
DXJ,WisdomTree Japan Hedged Equity Fund,$113.7600,-0.4700,-0.4138781261007397%,down,
DXJS,WisdomTree Japan Hedged SmallCap Equity Fund,$36.4300,-0.5000,-1.3819789939192924%,down,
DXUV,Dimensional ETF Trust Dimensional US Vector Equity ETF,$53.4000,0.0400,0.07548594074353651%,up,
DYFI,IDX Dynamic Fixed Income ETF,$22.9650,0.0360,0.1570338058887677%,up,
DYLD,LeaderShares Dynamic Yield ETF,$22.5260,-0.0200,-0.08888888888888889%,down,
DYLG,Global X Funds Global X Dow 30 Covered Call & Growth ETF,$25.7786,-0.0117,-0.045457547701285635%,down,
DYNF,iShares U.S. Equity Factor Rotation Active ETF,$52.9900,-0.0600,-0.11376564277588168%,down,
DYNI,IDX Dynamic Innovation ETF,$26.6444,-0.0855,-0.3215494546822114%,down,
DYTA,SGI Dynamic Tactical ETF,$27.7548,-0.0588,-0.21227436823104692%,down,
DZZ,NO Name,$1.8600,0.0000,0%,unch,
EAFG,Pacer Funds Trust Pacer Developed Markets Cash Cows Growth Lea,$21.3611,-0.0274,-0.12844974286611693%,down,
EAGG,iShares ESG Aware U.S. Aggregate Bond ETF,$46.7800,0.0600,0.1284796573875803%,up,
EAGL,The 2023 ETF Series Trust Eagle Capital Select Equity ETF,$29.5100,0.0600,0.20429009193054137%,up,
EALT,Innovator ETFs Trust Innovator U.S. Equity 5 to 15 Buffer ETF ,$32.3100,0.0300,0.09305210918114143%,up,
EAOA,iShares ESG Aware 80/20 Aggressive Allocation ETF,$37.6600,0.0861,0.2293180916260277%,up,
EAOK,iShares ESG Aware 30/70 Conservative Allocation ETF,$26.1250,0.0355,0.13607163117305243%,up,
EAOM,iShares ESG Aware 40/60 Moderate Allocation ETF,$28.3519,0.0388,0.1371984639429707%,up,
EAOR,iShares ESG Aware 60/40 Balanced Allocation ETF,$32.7482,0.0413,0.12650008269981194%,up,
EAPR,Innovator Emerging Markets Power Buffer ETF April,$27.6349,0.0534,0.19393640048229877%,up,
EASG,Xtrackers MSCI EAFE Selection Equity ETF,$33.7763,0.0515,0.15295515295515294%,up,
EATZ,AdvisorShares Restaurant ETF,$29.6307,0.1261,0.42236490854342723%,up,
EBI,Longview Advantage ETF,$49.8399,0.0826,0.16652352900856005%,up,
EBIT,Harbor ETF Trust Harbor AlphaEdge Small Cap Earners ETF,$30.9959,0.2597,0.8454436544521707%,up,
EBIZ,Global X E-commerce ETF,$31.0000,0.2100,0.6765463917525774%,up,
EBND,SPDR Bloomberg Emerging Markets Local Bond ETF,$20.9400,0.0600,0.28653295128939826%,up,
